{
  "schema_version": "1.0",
  "case_id": "c_tb_pos_001",
  "status": "ANALYSED",
  "input": {
    "format": "dicom",
    "phi_tags_removed": 12,
    "error": null
  },
  "gate": {
    "quality_pass": true,
    "quality_reasons": [],
    "ood_score": 0.142,
    "ood_threshold": 0.241,
    "gate_pass": true,
    "view": null
  },
  "segmentation": {
    "sanity_pass": true,
    "fail_reasons": [],
    "crop_box": [
      20,
      15,
      492,
      480
    ],
    "fallback_full": false
  },
  "classifier": {
    "model_id": "radino_crop_m0.10_clahe0_bin",
    "head": "binary",
    "p_tb_raw": 0.91,
    "p_tb_cal": 0.88,
    "temperature": 1.37,
    "three_class": {
      "healthy": 0.03,
      "sick_non_tb": 0.1,
      "tb": 0.87
    }
  },
  "detector": {
    "model_id": "dfine_512",
    "conf_threshold": 0.42,
    "n_lesions": 2,
    "boxes": [
      {
        "xyxy": [
          120,
          85,
          210,
          175
        ],
        "score": 0.84
      },
      {
        "xyxy": [
          310,
          140,
          390,
          220
        ],
        "score": 0.72
      }
    ]
  },
  "triage": {
    "t_lower": 0.18,
    "t_upper": 0.83,
    "category_pre_link": "TB",
    "link_fired": false,
    "category_final": "TB",
    "screen_positive": true,
    "operating_point": "locked_default"
  },
  "explainability": {
    "heatmap_path": "runs/r001/c_tb_pos_001_cam.npy",
    "overlay_path": "runs/r001/c_tb_pos_001_overlay.png"
  },
  "versions": {
    "model_version": "reg-v1-3b9c",
    "split_version": "v1",
    "decisions_hash": "sha256:5e1d4b2",
    "git_sha": "c0ffee1"
  },
  "timing_ms": {
    "standardise": 35,
    "gate": 180,
    "segment": 90,
    "classify": 160,
    "detect": 240,
    "explain": 380,
    "total": 1085
  },
  "disclaimer": "Decision support for TB triage only, not a diagnosis. Validated only on public research datasets; not prospectively clinically validated."
}