{
  "schema_version": "1.0",
  "case_id": "c_refer_002",
  "status": "ANALYSED",
  "input": {
    "format": "png",
    "phi_tags_removed": 0,
    "error": null
  },
  "gate": {
    "quality_pass": true,
    "quality_reasons": [],
    "ood_score": 0.195,
    "ood_threshold": 0.241,
    "gate_pass": true,
    "view": null
  },
  "segmentation": {
    "sanity_pass": true,
    "fail_reasons": [],
    "crop_box": [
      10,
      0,
      507,
      493
    ],
    "fallback_full": false
  },
  "classifier": {
    "model_id": "radino_crop_m0.10_clahe0_bin",
    "head": "binary",
    "p_tb_raw": 0.52,
    "p_tb_cal": 0.48,
    "temperature": 1.37,
    "three_class": {
      "healthy": 0.25,
      "sick_non_tb": 0.35,
      "tb": 0.4
    }
  },
  "detector": {
    "model_id": "dfine_512",
    "conf_threshold": 0.42,
    "n_lesions": 0,
    "boxes": []
  },
  "triage": {
    "t_lower": 0.18,
    "t_upper": 0.83,
    "category_pre_link": "REFER",
    "link_fired": false,
    "category_final": "REFER",
    "screen_positive": true,
    "operating_point": "locked_default"
  },
  "explainability": {
    "heatmap_path": "runs/r001/c_refer_002_cam.npy",
    "overlay_path": "runs/r001/c_refer_002_overlay.png"
  },
  "versions": {
    "model_version": "reg-v1-3b9c",
    "split_version": "v1",
    "decisions_hash": "sha256:5e1d4b2",
    "git_sha": "c0ffee1"
  },
  "timing_ms": {
    "standardise": 35,
    "gate": 180,
    "segment": 90,
    "classify": 160,
    "detect": 240,
    "explain": 380,
    "total": 1085
  },
  "disclaimer": "Decision support for TB triage only, not a diagnosis. Validated only on public research datasets; not prospectively clinically validated."
}